{
  "schema_version": "study4f-e1-q1r-global-routing-survey-v1",
  "observed_at": "2026-08-21T02:59:03Z",
  "scope": {
    "cloud": "Global Azure",
    "subscription_last_four": "d32e",
    "subscription_salted_sha256": "9adb2550056c6e57f03aca51c3a82a4fed3808d9c17b9b0357f15260adc0bb59",
    "full_subscription_id_persisted": false,
    "physical_regions_enumerated": 63,
    "route_pairs_classified": 126,
    "target_skus": [
      "Standard_NC40ads_H100_v5",
      "Standard_NC24ads_A100_v4"
    ],
    "target_families": [
      "StandardNCadsH100v5Family",
      "StandardNCADSA100v4Family"
    ]
  },
  "read_counts": {
    "subscription_location_queries": 1,
    "target_sku_queries": 2,
    "current_australiaeast_h100_quota_queries": 1,
    "current_australiaeast_h100_quota_queries_reused": 1,
    "additional_compute_usage_queries": 28,
    "australiaeast_a100_specific_quota_queries": 1,
    "support_ticket_gets_reused": 1,
    "survey_retries": 0,
    "polling_loops": 0
  },
  "classification_definitions": {
    "R0": "R0_QUOTA_ALREADY_SUFFICIENT",
    "R1": "R1_SKU_ALLOWED_QUOTA_INSUFFICIENT",
    "R2": "R2_SUBSCRIPTION_RESTRICTED",
    "R3": "R3_NOT_OFFERED_OR_UNRESOLVABLE"
  },
  "ranking_rule": [
    "classification order R0, R1, R2, R3",
    "smallest family-quota deficit",
    "smallest regional-quota deficit",
    "region name lexicographically"
  ],
  "physical_capacity_for_every_entry": "UNKNOWN_NOT_TESTED",
  "class_counts": {
    "H100": {
      "R0": 0,
      "R1": 23,
      "R2": 0,
      "R3": 40
    },
    "A100": {
      "R0": 0,
      "R1": 14,
      "R2": 10,
      "R3": 39
    }
  },
  "recommendations": {
    "H100": {
      "kind": "ONE_FUTURE_OPERATOR_AUTHORIZED_QUOTA_CANDIDATE",
      "region": "australiaeast",
      "classification": "R1_SKU_ALLOWED_QUOTA_INSUFFICIENT",
      "family_quota_deficit": 40,
      "regional_quota_deficit": 0,
      "future_quota_request_recommended": true
    },
    "A100": {
      "kind": "ONE_FUTURE_OPERATOR_AUTHORIZED_QUOTA_CANDIDATE",
      "region": "brazilsouth",
      "classification": "R1_SKU_ALLOWED_QUOTA_INSUFFICIENT",
      "family_quota_deficit": 24,
      "regional_quota_deficit": 0,
      "future_quota_request_recommended": true
    }
  },
  "rankings": {
    "H100": [
      {
        "rank": 1,
        "region": "australiaeast",
        "classification": "R1_SKU_ALLOWED_QUOTA_INSUFFICIENT",
        "family_quota_deficit": 40,
        "regional_quota_deficit": 0
      },
      {
        "rank": 2,
        "region": "canadacentral",
        "classification": "R1_SKU_ALLOWED_QUOTA_INSUFFICIENT",
        "family_quota_deficit": 40,
        "regional_quota_deficit": 0
      },
      {
        "rank": 3,
        "region": "centralindia",
        "classification": "R1_SKU_ALLOWED_QUOTA_INSUFFICIENT",
        "family_quota_deficit": 40,
        "regional_quota_deficit": 0
      },
      {
        "rank": 4,
        "region": "centralus",
        "classification": "R1_SKU_ALLOWED_QUOTA_INSUFFICIENT",
        "family_quota_deficit": 40,
        "regional_quota_deficit": 0
      },
      {
        "rank": 5,
        "region": "eastus",
        "classification": "R1_SKU_ALLOWED_QUOTA_INSUFFICIENT",
        "family_quota_deficit": 40,
        "regional_quota_deficit": 0
      },
      {
        "rank": 6,
        "region": "eastus2",
        "classification": "R1_SKU_ALLOWED_QUOTA_INSUFFICIENT",
        "family_quota_deficit": 40,
        "regional_quota_deficit": 0
      },
      {
        "rank": 7,
        "region": "germanywestcentral",
        "classification": "R1_SKU_ALLOWED_QUOTA_INSUFFICIENT",
        "family_quota_deficit": 40,
        "regional_quota_deficit": 0
      },
      {
        "rank": 8,
        "region": "indonesiacentral",
        "classification": "R1_SKU_ALLOWED_QUOTA_INSUFFICIENT",
        "family_quota_deficit": 40,
        "regional_quota_deficit": 0
      },
      {
        "rank": 9,
        "region": "japaneast",
        "classification": "R1_SKU_ALLOWED_QUOTA_INSUFFICIENT",
        "family_quota_deficit": 40,
        "regional_quota_deficit": 0
      },
      {
        "rank": 10,
        "region": "jioindiawest",
        "classification": "R1_SKU_ALLOWED_QUOTA_INSUFFICIENT",
        "family_quota_deficit": 40,
        "regional_quota_deficit": 0
      },
      {
        "rank": 11,
        "region": "koreacentral",
        "classification": "R1_SKU_ALLOWED_QUOTA_INSUFFICIENT",
        "family_quota_deficit": 40,
        "regional_quota_deficit": 0
      },
      {
        "rank": 12,
        "region": "malaysiawest",
        "classification": "R1_SKU_ALLOWED_QUOTA_INSUFFICIENT",
        "family_quota_deficit": 40,
        "regional_quota_deficit": 0
      },
      {
        "rank": 13,
        "region": "northeurope",
        "classification": "R1_SKU_ALLOWED_QUOTA_INSUFFICIENT",
        "family_quota_deficit": 40,
        "regional_quota_deficit": 0
      },
      {
        "rank": 14,
        "region": "southcentralus",
        "classification": "R1_SKU_ALLOWED_QUOTA_INSUFFICIENT",
        "family_quota_deficit": 40,
        "regional_quota_deficit": 0
      },
      {
        "rank": 15,
        "region": "southeastasia",
        "classification": "R1_SKU_ALLOWED_QUOTA_INSUFFICIENT",
        "family_quota_deficit": 40,
        "regional_quota_deficit": 0
      },
      {
        "rank": 16,
        "region": "spaincentral",
        "classification": "R1_SKU_ALLOWED_QUOTA_INSUFFICIENT",
        "family_quota_deficit": 40,
        "regional_quota_deficit": 0
      },
      {
        "rank": 17,
        "region": "swedencentral",
        "classification": "R1_SKU_ALLOWED_QUOTA_INSUFFICIENT",
        "family_quota_deficit": 40,
        "regional_quota_deficit": 0
      },
      {
        "rank": 18,
        "region": "switzerlandnorth",
        "classification": "R1_SKU_ALLOWED_QUOTA_INSUFFICIENT",
        "family_quota_deficit": 40,
        "regional_quota_deficit": 0
      },
      {
        "rank": 19,
        "region": "uksouth",
        "classification": "R1_SKU_ALLOWED_QUOTA_INSUFFICIENT",
        "family_quota_deficit": 40,
        "regional_quota_deficit": 0
      },
      {
        "rank": 20,
        "region": "westeurope",
        "classification": "R1_SKU_ALLOWED_QUOTA_INSUFFICIENT",
        "family_quota_deficit": 40,
        "regional_quota_deficit": 0
      },
      {
        "rank": 21,
        "region": "westus",
        "classification": "R1_SKU_ALLOWED_QUOTA_INSUFFICIENT",
        "family_quota_deficit": 40,
        "regional_quota_deficit": 0
      },
      {
        "rank": 22,
        "region": "westus2",
        "classification": "R1_SKU_ALLOWED_QUOTA_INSUFFICIENT",
        "family_quota_deficit": 40,
        "regional_quota_deficit": 0
      },
      {
        "rank": 23,
        "region": "westus3",
        "classification": "R1_SKU_ALLOWED_QUOTA_INSUFFICIENT",
        "family_quota_deficit": 40,
        "regional_quota_deficit": 0
      },
      {
        "rank": 24,
        "region": "brazilsouth",
        "classification": "R3_NOT_OFFERED_OR_UNRESOLVABLE",
        "family_quota_deficit": 40,
        "regional_quota_deficit": 0
      },
      {
        "rank": 25,
        "region": "francecentral",
        "classification": "R3_NOT_OFFERED_OR_UNRESOLVABLE",
        "family_quota_deficit": 40,
        "regional_quota_deficit": 0
      },
      {
        "rank": 26,
        "region": "italynorth",
        "classification": "R3_NOT_OFFERED_OR_UNRESOLVABLE",
        "family_quota_deficit": 40,
        "regional_quota_deficit": 0
      },
      {
        "rank": 27,
        "region": "polandcentral",
        "classification": "R3_NOT_OFFERED_OR_UNRESOLVABLE",
        "family_quota_deficit": 40,
        "regional_quota_deficit": 0
      },
      {
        "rank": 28,
        "region": "australiacentral",
        "classification": "R3_NOT_OFFERED_OR_UNRESOLVABLE",
        "family_quota_deficit": null,
        "regional_quota_deficit": null
      },
      {
        "rank": 29,
        "region": "australiacentral2",
        "classification": "R3_NOT_OFFERED_OR_UNRESOLVABLE",
        "family_quota_deficit": null,
        "regional_quota_deficit": null
      },
      {
        "rank": 30,
        "region": "australiasoutheast",
        "classification": "R3_NOT_OFFERED_OR_UNRESOLVABLE",
        "family_quota_deficit": null,
        "regional_quota_deficit": null
      },
      {
        "rank": 31,
        "region": "austriaeast",
        "classification": "R3_NOT_OFFERED_OR_UNRESOLVABLE",
        "family_quota_deficit": null,
        "regional_quota_deficit": null
      },
      {
        "rank": 32,
        "region": "belgiumcentral",
        "classification": "R3_NOT_OFFERED_OR_UNRESOLVABLE",
        "family_quota_deficit": null,
        "regional_quota_deficit": null
      },
      {
        "rank": 33,
        "region": "brazilsoutheast",
        "classification": "R3_NOT_OFFERED_OR_UNRESOLVABLE",
        "family_quota_deficit": null,
        "regional_quota_deficit": null
      },
      {
        "rank": 34,
        "region": "canadaeast",
        "classification": "R3_NOT_OFFERED_OR_UNRESOLVABLE",
        "family_quota_deficit": null,
        "regional_quota_deficit": null
      },
      {
        "rank": 35,
        "region": "centraluseuap",
        "classification": "R3_NOT_OFFERED_OR_UNRESOLVABLE",
        "family_quota_deficit": null,
        "regional_quota_deficit": null
      },
      {
        "rank": 36,
        "region": "chilecentral",
        "classification": "R3_NOT_OFFERED_OR_UNRESOLVABLE",
        "family_quota_deficit": null,
        "regional_quota_deficit": null
      },
      {
        "rank": 37,
        "region": "denmarkeast",
        "classification": "R3_NOT_OFFERED_OR_UNRESOLVABLE",
        "family_quota_deficit": null,
        "regional_quota_deficit": null
      },
      {
        "rank": 38,
        "region": "eastasia",